{
  "SchemaVersion": 1,
  "IsEnabled": true,
  "PlcCode": "PLC02",
  "Driver": "siemens-s7",
  "Host": "192.168.1.20",
  "Port": 102,
  "ProtocolOptions": {
    "plc": "S1200",
    "connect-timeout-ms": "5000",
    "receive-timeout-ms": "5000"
  },
  "HeartbeatMonitorRegister": "DB1.0",
  "HeartbeatPollingInterval": 3000,
  "Channels": [
    {
      "Measurement": "power",
      "ChannelCode": "PLC02C01",
      "EnableBatchRead": false,
      "BatchSize": 5,
      "AcquisitionInterval": 200,
      "AcquisitionMode": "Always",
      "Metrics": [
        {
          "MetricLabel": "current",
          "FieldName": "current",
          "Register": "DB1.10",
          "Index": 0,
          "DataType": "float"
        }
      ]
    }
  ]
}
