{
  "SchemaVersion": 1,
  "IsEnabled": true,
  "PlcCode": "PLC03",
  "Driver": "melsec-mc",
  "Host": "192.168.1.30",
  "Port": 6000,
  "ProtocolOptions": {
    "connect-timeout-ms": "5000",
    "receive-timeout-ms": "5000"
  },
  "HeartbeatMonitorRegister": "D100",
  "HeartbeatPollingInterval": 3000,
  "Channels": [
    {
      "Measurement": "production",
      "ChannelCode": "PLC03C01",
      "EnableBatchRead": true,
      "BatchReadRegister": "D6100",
      "BatchReadLength": 16,
      "BatchSize": 1,
      "AcquisitionInterval": 0,
      "AcquisitionMode": "Conditional",
      "ConditionalAcquisition": {
        "Register": "D6006",
        "DataType": "short",
        "StartTriggerMode": "RisingEdge",
        "EndTriggerMode": "FallingEdge"
      },
      "Metrics": [
        {
          "MetricLabel": "productCode",
          "FieldName": "productCode",
          "Register": "D6100",
          "Index": 0,
          "DataType": "string",
          "StringByteLength": 16,
          "Encoding": "utf-8"
        },
        {
          "MetricLabel": "count",
          "FieldName": "count",
          "Register": "D6110",
          "Index": 10,
          "DataType": "short"
        }
      ]
    }
  ]
}
