{
  "SchemaVersion": 1,
  "IsEnabled": true,
  "PlcCode": "PLC01",
  "Driver": "melsec-a1e",
  "Host": "127.0.0.1",
  "Port": 502,
  "ProtocolOptions": {
    "connect-timeout-ms": "5000",
    "receive-timeout-ms": "5000"
  },
  "HeartbeatMonitorRegister": "D100",
  "HeartbeatPollingInterval": 5000,
  "Channels": [
    {
      "Measurement": "sensor",
      "ChannelCode": "PLC01C01",
      "EnableBatchRead": true,
      "BatchReadRegister": "D6000",
      "BatchReadLength": 10,
      "BatchSize": 10,
      "AcquisitionInterval": 100,
      "AcquisitionMode": "Always",
      "Metrics": [
        {
          "MetricLabel": "temperature",
          "FieldName": "temperature",
          "Register": "D6000",
          "Index": 0,
          "DataType": "short",
          "EvalExpression": "value / 100.0"
        }
      ]
    }
  ]
}
